{
  "slug": "example_value",
  "name": "Example Title",
  "labels": [],
  "code": "example_value",
  "subject": "example_value",
  "from_email": "user@example.com",
  "from_name": "example_value",
  "text": "example_value",
  "publish_name": "example_value",
  "publish_code": "example_value",
  "publish_subject": "example_value",
  "publish_from_email": "user@example.com",
  "publish_from_name": "example_value",
  "publish_text": "example_value",
  "published_at": "2026-01-15T10:30:00Z",
  "created_at": "2026-01-15T10:30:00Z",
  "updated_at": "2026-01-15T10:30:00Z"
}